{
  "id": "cn-ancient.base.ramp-stone-a",
  "name": "石坡道 A",
  "kit": "cn-ancient",
  "category": "components/base",
  "tier": "primitive",
  "tags": [
    "坡道",
    "辇道"
  ],
  "dimensions_m": [
    2,
    0.75,
    3
  ],
  "polycount": 8,
  "pivot": "bottom-center",
  "lods": {
    "lod0": "model.glb"
  },
  "collision": "box",
  "sockets": [],
  "materials": [
    "stone/qingshi"
  ],
  "variants": [],
  "license": "CC0-1.0",
  "author": "sdzdrccc"
}
