{
  "id": "cn-ancient.wall.solid-a",
  "name": "实墙 A",
  "kit": "cn-ancient",
  "category": "components/wall",
  "tier": "primitive",
  "tags": [
    "实墙",
    "模数墙"
  ],
  "dimensions_m": [
    2,
    3,
    0.24
  ],
  "polycount": 12,
  "pivot": "bottom-center",
  "lods": {
    "lod0": "model.glb"
  },
  "collision": "box",
  "sockets": [],
  "materials": [
    "wall/baiqiang"
  ],
  "variants": [],
  "license": "CC0-1.0",
  "author": "sdzdrccc"
}
