{
  "id": "cn-ancient.pillar.square-a",
  "name": "方柱 A",
  "kit": "cn-ancient",
  "category": "components/pillar",
  "tier": "primitive",
  "tags": [
    "方柱"
  ],
  "dimensions_m": [
    0.3,
    3,
    0.3
  ],
  "polycount": 12,
  "pivot": "bottom-center",
  "lods": {
    "lod0": "model.glb"
  },
  "collision": "box",
  "sockets": [],
  "materials": [
    "wood/zhuqi"
  ],
  "variants": [],
  "license": "CC0-1.0",
  "author": "sdzdrccc"
}
