{
  "id": "cn-ancient.base.stone-flat-a",
  "name": "石台基·平顶 A",
  "kit": "cn-ancient",
  "category": "components/base",
  "tier": "primitive",
  "tags": [
    "台基",
    "石作"
  ],
  "dimensions_m": [
    4,
    0.5,
    4
  ],
  "polycount": 12,
  "pivot": "bottom-center",
  "lods": {
    "lod0": "model.glb"
  },
  "collision": "box",
  "sockets": [],
  "materials": [
    "stone/qingshi"
  ],
  "variants": [],
  "license": "CC0-1.0",
  "author": "sdzdrccc"
}
